1;1642701972;5;7;My life is a suck ;Ahhh, My machine crashed while I was working. ..;/static/Q11.jpg
2;1642702216;8;2; I don't know why;I just finished a program I don't know how it works, BUT it works ;/static/Q23
3;1642702787;3;4;HTML;YEEE GUYS! I've learned how to code HTML;/static/Q310.png
4;1642703028;5;0;Python;So I just started learning Python.;0
5;1642713366;3;0;whatsUp?;nothing...nothing...a6z?k@LLa&NOTHING!;0
6;1642719653;7;0;?????????????????????;?????????????a6z?k@LLa&??????a6z?k@LLa&?;/static/Q6nagylol.png
